{
  "system_scope": {
    "summary": "The system is an Event framework intended to be used by an application, in which application logic and the framework are highly inter-dependent. It comprises a Main module that is part of the framework, an Event Manager that interacts directly with application handlers, an Event Queue, and a base Handler component extended by standard and application-specific handlers. The business goal is to provide this framework so applications can handle and process events through component interaction and utilize the framework's services.",
    "basis": "observed",
    "source_refs": [
      "evaluation_inputs.system_description",
      "evaluation_inputs.business_context.business_goals[0]",
      "evaluation_inputs.business_context.business_goals[1]",
      "evaluation_inputs.business_context.business_goals[2]"
    ]
  },
  "business_drivers": [
    {
      "id": "BD-1",
      "statement": "Provide an Event framework to be used by an application.",
      "kind": "business_goal",
      "basis": "observed",
      "source_refs": ["evaluation_inputs.business_context.business_goals[0]"]
    },
    {
      "id": "BD-2",
      "statement": "Handle and process events through component interaction.",
      "kind": "business_goal",
      "basis": "observed",
      "source_refs": ["evaluation_inputs.business_context.business_goals[1]"]
    },
    {
      "id": "BD-3",
      "statement": "Allow application components to utilize the framework services.",
      "kind": "business_goal",
      "basis": "observed",
      "source_refs": ["evaluation_inputs.business_context.business_goals[2]"]
    },
    {
      "id": "BD-4",
      "statement": "The system must handle system termination via a STOP handler.",
      "kind": "technical_constraint",
      "basis": "observed",
      "source_refs": ["evaluation_inputs.business_context.technical_constraints[0]"]
    },
    {
      "id": "BD-5",
      "statement": "The system must maintain itself in an idle state until input is received.",
      "kind": "technical_constraint",
      "basis": "observed",
      "source_refs": ["evaluation_inputs.business_context.technical_constraints[1]"]
    },
    {
      "id": "BD-6",
      "statement": "Variability is named as an architectural driver for this system.",
      "kind": "architectural_driver",
      "basis": "observed",
      "source_refs": ["evaluation_inputs.business_context.architectural_drivers[0]"]
    },
    {
      "id": "BD-7",
      "statement": "Reliability is named as an architectural driver for this system.",
      "kind": "architectural_driver",
      "basis": "observed",
      "source_refs": ["evaluation_inputs.business_context.architectural_drivers[1]"]
    },
    {
      "id": "BD-8",
      "statement": "Conceptual Integrity is named as an architectural driver for this system.",
      "kind": "architectural_driver",
      "basis": "observed",
      "source_refs": ["evaluation_inputs.business_context.architectural_drivers[2]"]
    },
    {
      "id": "BD-9",
      "statement": "Functionality is named as an architectural driver for this system.",
      "kind": "architectural_driver",
      "basis": "observed",
      "source_refs": ["evaluation_inputs.business_context.architectural_drivers[3]"]
    },
    {
      "id": "BD-10",
      "statement": "Modifiability is named as an architectural driver for this system.",
      "kind": "architectural_driver",
      "basis": "observed",
      "source_refs": ["evaluation_inputs.business_context.architectural_drivers[4]"]
    }
  ],
  "architecture_evidence": [
    {
      "id": "AE-1",
      "statement": "The architecture documentation status is 'fully developed architecture with class diagrams, component descriptions, and defined component interactions.'",
      "kind": "documentation_status",
      "basis": "observed",
      "source_refs": ["evaluation_inputs.phase_1_discovery.initial_documentation_status"]
    },
    {
      "id": "AE-2",
      "statement": "The application logic and the framework are described as highly inter-dependent.",
      "kind": "decision",
      "basis": "observed",
      "source_refs": ["evaluation_inputs.system_description"]
    },
    {
      "id": "AE-3",
      "statement": "The Main module is part of the framework.",
      "kind": "component",
      "basis": "observed",
      "source_refs": ["evaluation_inputs.system_description"]
    },
    {
      "id": "AE-4",
      "statement": "The Event Manager interacts directly with application handlers.",
      "kind": "connector",
      "basis": "observed",
      "source_refs": ["evaluation_inputs.system_description"]
    },
    {
      "id": "AE-5",
      "statement": "The architecture features an Event Queue component.",
      "kind": "component",
      "basis": "observed",
      "source_refs": ["evaluation_inputs.system_description"]
    },
    {
      "id": "AE-6",
      "statement": "The architecture has a base Handler component that is extended by standard handlers and application-specific handlers.",
      "kind": "component",
      "basis": "observed",
      "source_refs": ["evaluation_inputs.system_description"]
    },
    {
      "id": "AE-7",
      "statement": "The system accepts input via a Command Line Interface (CLI).",
      "kind": "deployment",
      "basis": "observed",
      "source_refs": ["evaluation_inputs.phase_2_architectural_context.hardware_view_description[0]"]
    },
    {
      "id": "AE-8",
      "statement": "Single processor execution is implied, i.e. sequential event processing.",
      "kind": "deployment",
      "basis": "observed",
      "source_refs": ["evaluation_inputs.phase_2_architectural_context.hardware_view_description[1]"]
    },
    {
      "id": "AE-9",
      "statement": "Events must be dispatched in a First-Come-First-Served (FIFO) pattern.",
      "kind": "runtime_constraint",
      "basis": "observed",
      "source_refs": ["evaluation_inputs.phase_2_architectural_context.runtime_constraints[0]"]
    },
    {
      "id": "AE-10",
      "statement": "The system must maintain an 'idle wait' state until input is received.",
      "kind": "runtime_constraint",
      "basis": "observed",
      "source_refs": ["evaluation_inputs.phase_2_architectural_context.runtime_constraints[1]"]
    },
    {
      "id": "AE-11",
      "statement": "Application logic is embedded within framework components.",
      "kind": "runtime_constraint",
      "basis": "observed",
      "source_refs": ["evaluation_inputs.phase_2_architectural_context.runtime_constraints[2]"]
    },
    {
      "id": "AE-12",
      "statement": "The performance proxy used for this architecture is the number of components involved in a transaction.",
      "kind": "quantitative_parameter",
      "basis": "observed",
      "source_refs": ["evaluation_inputs.quantitative_model_parameters.performance_proxy"]
    },
    {
      "id": "AE-13",
      "statement": "Transaction speed is characterized qualitatively as slow, attributed to a high number of components involved.",
      "kind": "quantitative_parameter",
      "basis": "observed",
      "source_refs": ["evaluation_inputs.quantitative_model_parameters.transaction_speed"]
    },
    {
      "id": "AE-14",
      "statement": "The architecture limit for event managers is 1.",
      "kind": "quantitative_parameter",
      "basis": "observed",
      "source_refs": ["evaluation_inputs.quantitative_model_parameters.architecture_limits.event_managers"]
    },
    {
      "id": "AE-15",
      "statement": "The architecture limit for event queues is 1.",
      "kind": "quantitative_parameter",
      "basis": "observed",
      "source_refs": ["evaluation_inputs.quantitative_model_parameters.architecture_limits.event_queues"]
    },
    {
      "id": "AE-16",
      "statement": "The style probe target style for this evaluation is Event-Driven Architecture.",
      "kind": "style_probe",
      "basis": "observed",
      "source_refs": ["evaluation_inputs.investigative_prompts.style_probes.target_style"]
    },
    {
      "id": "AE-17",
      "statement": "Style probe question posed against the target style: 'Does the system allow unauthorized access?'",
      "kind": "style_probe",
      "basis": "observed",
      "source_refs": ["evaluation_inputs.investigative_prompts.style_probes.questions[0]"]
    },
    {
      "id": "AE-18",
      "statement": "Style probe question posed against the target style: 'Does the architecture portray data confidentiality?'",
      "kind": "style_probe",
      "basis": "observed",
      "source_refs": ["evaluation_inputs.investigative_prompts.style_probes.questions[1]"]
    },
    {
      "id": "AE-19",
      "statement": "Style probe question posed against the target style: 'Does the architecture process any task in the fastest possible speed?'",
      "kind": "style_probe",
      "basis": "observed",
      "source_refs": ["evaluation_inputs.investigative_prompts.style_probes.questions[2]"]
    }
  ],
  "open_questions": [
    {
      "question": "Can the components of the architecture be reused for future projects?",
      "source_refs": ["evaluation_inputs.phase_1_discovery.evaluator_inquiry_questions[0]"]
    },
    {
      "question": "Can the framework be expanded in the future to accommodate a new application or new components?",
      "source_refs": ["evaluation_inputs.phase_1_discovery.evaluator_inquiry_questions[1]"]
    },
    {
      "question": "Will the system handle any input given by the user and handle invalid input?",
      "source_refs": ["evaluation_inputs.phase_1_discovery.evaluator_inquiry_questions[2]"]
    },
    {
      "question": "Is the architecture consistent in behavior?",
      "source_refs": ["evaluation_inputs.phase_1_discovery.evaluator_inquiry_questions[3]"]
    },
    {
      "question": "Can any new application-specific functionality be added to the architecture?",
      "source_refs": ["evaluation_inputs.phase_1_discovery.evaluator_inquiry_questions[4]"]
    },
    {